"what sports fans are known as cheese heads?","Los Angeles Dodger Fans","Philadelphia Eagles Fans","Portland Trail Blazers Fans","Green Bay Packer Fans"
"from which european country did brazil gain its independence?","Spain","France","Great Britain","Portugal"
"in 1631 after the death of his wife emperor shah jahan of india created what national landmark?","Hawa Mahal","Charminar","Harmandir Sahib","Taj Mahal"
"napoleon was stopped when he tried to invade russia in which season?","Spring","Summer","Autumn","Winter"
"in what position did michelangelo paint the ceiling of the sistine chapel?","Hanging From The Ceiling","Sitting Down","On His Tip Toes","On His Back"
"which simpson is not a cartoon?","Lisa","Maggie","Marge","O.J."
"in the movie big hero 6 baymax was created to?","Fight","Clean Around The House","Walk A Dog","Be A Personal Doctor"
"what does the science term viscosity mean?","That's Not A Word","The Ability Of Solids And Gasses To Touch","It's Not A Science Term","The Ability Of A Liquid To Resist To Flow"
"the great blue hole is a submarine sinkhole off the coast of what country?","Mexico","Paraguay","Brazil","Belize"
"what were the names of the twin characters that appeared on the hit tv shows friends and mad about you?","Rachel And Kate","Monica And Marie","Joey And Drake","Phoebe And Ursula"
"what is the mascot of aflac insurance?","A gecko","The general","Flo","A duck"
"what country sent the first dog to space and what was its name?","Russia, Sputnik","Usa, Sputnik","Usa, Rover","Russia, Laika"
"which of the following is not a childrens writer?","Roald Dahl","Enid Blyton","Meg Cabot","Nicholas Sparks"
"which of these areas were not conquered by muslim empires caliphates?","Persia","Arabia","Spain","Southeast Asia"
"the amplitude of a sound wave determines which of the following?","Pitch","Frequency","Duration","Loudness"
"a group of dolphins is called?","Cast","Dole","Pack","Pod"
"what food is considered typical swedish?","Hamburgers","Mashed Potatoes","Quinoa Salad","Meatballs"
"which baseball star hit over 60 home runs in a season for the cubs?","Carlos Lee","Jason Giambi","David Ortiz","Sammy Sosa"
"which of these tv shows was not set in new york city?","Seinfeld","Friends","How I Met Your Mother","Cheers"
"what does dna stand for?","Dexterity Nucleus Of Atoms","Drawing Of Numbres Attractiveness","Download Of Nitrogen Acid","Deoxyribonucleic Acid"
"what profession is nemos captor in the movie finding nemo?","Nurse","Psychiatrist","Photographer","Dentist"
"where is barrows island?","Canada","U.S.A","Singapore","Australia"
"black tuesday refers to what era in united states history?","Vietnam","Great Recession","Cold War","Great Depression"
"what color are spades on a playing card?","Red","White","Blue","Black"
"beagles have a strong sense of smell in airports what do officials use them for?","Sniffing Out Food In The Luggage","Sniffing Out People Who Smell Bad","Wrong Kind Of Breed","Sniffing Out Drugs And Weapons"
"which cranial nerve supplies the diaphragm?","Hypoglossal","Trigeminal","Accessory","Vagus"
"quel etait lanimal sacre du calendrier maya?","Chat","Lion","Cheval","Jaguar"
"what is the nationality of ferdinand magellan?","Spanish","French","English","Portugese"
"what country did the ottoman empire rule?","USA","India","Rome","Turkey"
"which is a starch?","Strawberries","Tomatoes","Cookies","Pasta"
"what british ocean liner was sunk by the german submarine u 20 in 1915 off the coast of ireland?","Titanic","Olympic","Mauritania","Lusitania"
"how many beats are in a measure with the time signature of 24 time?","4","1","8","2"
"where in the body does cellular respiration happen?","Nucleus","Spine","Femur","Mitochondria"
"which is the highest navigable lake in the world?","Caspian Sea","Crater Lake","Lake Karachay","Lake Titikaka"
"what vessels take blood away from the heart?","Aorta","Veins","Capillaries","Arteries"
"which of the following animals lays eggs?","Star-Nosed Mole","Hedgehog","Rabbit","Echidna"
"somalia is the shape of what?","A Box","The Letter T","A Boot","The Number Seven"
"how many meters are in a mile?","1800","1500","800","1600"
"where is the tate museum of art?","New York","Los Angeles","Seattle","London"
"in what continent is estonia?","Asia","Africa","South American","Europe"
"who played the part of woody in the disneypixar movie toy story?","Tim Allen","John Cena","Brian Cranston","Tom Hanks"
"what do humans breath out after cellular respiration?","Nitrous Oxide","Oxygen","Hydrogen","Carbon Dioxide"
"where is mitochondria located?","Liver","Brain","Bones","Cell"
"how did harry houdini get out of a straitjacket?","Broke The Jacket","Suck In Air Before It Got Put On","Exhale All The Air In His Lungs","Dislocated His Shoulder"
"which is not composed by wolfgang amadeus mozart?","The Marriage of Figaro","The Magic Flute","Don Giovanni","Carmen"
"which planet was downgraded to exoplanet in our solar system?","Uranus","Neptune","Mercury","Pluto"
"just once in american history have 3 men been president in the span of one year what year was it?","1901","1799","1947","1841"
"who discovered the concept behind the generator?","Hans Christian Oersted","Benjamin Franklin","Allesandro Volta","Michael Faraday"
"which nation has not won a fifa world cup?","Uruguay","Germany","Brazil","Russia"
"which is the grand canyon state?","California","Nevada","Colorado","Arizona"
"in 1945an allied conference decided the partition of germany in four occupation zones where was that conference held?","Los  Angeles","Casablanca","Moscow","Yalta"
"in what state did the little rock nine occur?","Texas","Florida","California","Arkansas"
"the west side story is a modern interpretation of what novel?","A Christmas Carol","Hamlet","The Taming Of The Shrew","Romeo And Juliet"
"what movie had a lounge singer hide as a nun?","A League Of Their Own","Sound Of Music","Saved!","Sister Act"
"what represents female?","Yx","Xy","Yy","Xx"
"who led the march on washington?","Martin Luther King","Herbert Hoover","Abraham Lincoln","Martin Luther King, Jr."
"what city is known as the city of 100 spires?","Budapest","Vienna","Paris","Prague"
"who won 2015 finals in nba?","Cavaliers","Jazz","Knicks","Warriors"
"which of the following isnt a state capitol?","Bismarck","Annapolis","Columbus","Los Angeles"
"what continent is known as the down under?","Antartica","Asia","Europe","Australia"
"when was the last time the united states won the womens world cup soccer final?","1999","2007","1995","2015"
"what song is by the music group imagine dragons?","Love Love","Badlands","Drive","Radioactive"
"in the game of baseball what is the only position that starts each pitch in foul territory?","Third Baseman","Right Fielder","First Baseman","Catcher"
"how long do skin cells last?","1 Week","4-5 Weeks","12 Hours","2-3 Weeks"
"what is sarajevo?","A river in Africa","A state in Asia","A hill in South America","A capital city in Europe"
"which of these cities is not in the northern hemisphere?","Cairo","Toronto","Havana","Quito"
"who did george washington run against in the first election?","Ben Franklin","Thomas Jefferson","John Adams","No One"
"what continent is known as down under?","Africa","Europe","America","Australia"
"who is not a famous american author?","Twain","Hawthorne","Steinbeck","Shakespeare"
"what is the main idea of an essay called?","Support","Counterargument","Counter claim","Thesis statement"
"what is the scientific word meaning to chew?","Munch","Consume","Eat","Masticate"
"what was disney studios first animated movie?","Cinderella","Peter Pan","101 Dalmations","Snow White"
"what medium do you use to embroider?","Paint And Paint Brush","Pencil And Paper","Clay And Water","Needle And Thread"
"which country is communist?","Canada","United States","South Korea","North Korea"
"who founded communism?","Vladimir Lenin","Joseph Stalin","Adam Smith","Karl Marx"
"what french fort did william braddock fail to capture during the french and indian war?","Fort Pitt","Fort Niagara","Fort Detroit","Fort Duquesne"
"what book is about a boy who sees the adult world as phony and wants to preserve innocence?","Lord Of The Flies","The Scarlet Letter","The Sun Also Rises","Catcher In The Rye"
"at the beginning of the tv series the walking dead where was rick grimes when the walkers came?","A Shopping Mall","Afghanistan","The Cdc","In A Hospital In A Coma"
"what do you call a three book series?","Biology","Quadalogy","Books","Trilogy"
"which of these countries is considered as the pearl of the orient seas?","Japan","China","Indonesia","Philippines"
"who makes the android operating system?","Apple","Yahoo","Microsoft","Google"
"what is the main religion in laos?","Christianity","Sikhism","Islam","Buddhism"
"what is the name of the place where jesus of nazareth was crucified?","The Mount Of Olives","Bethlehem","Rome","Golgotha"
"in hockey what is a blueliner?","A Offenseman","A Move","A Puck","A Defenseman"
"who said this quote to love is to buy mockery at the expense of moaning?","Plato","William Hazlitt","Jlio Dantas","William Shakespeare"
"what makes a fjord different than a regular inlet?","There's No Difference","A Mixing Of Fresh And Salt Water","They Lead To An Enclosed Body Of Water","High Cliffs On Both Sides"
"what sports equipment is required to be frozen prior to start of play?","Cleats","Skates","Ice Packs","Hockey Puck"
"what is pennys last name from the big bang theory?","Hardgrivs","Smith","Chandler","We Do Not Know"
"which of the following is a province in china?","Chengdu","Guilin","Shenyang","Xinjiang"
"in the simpsons what color is marges dress?","Yellow","Red","Orange","Green"
"which movie character used to order his martini shaken not stirred?","Gigolo Joe","Julian Kaye","Sherlock Holmes","James Bond"
"what city is the art capital of italy?","Rome","Bologna","Napoli","Florence"
"the magna carta was the first document to do what?","Place Limits On Wealthy Landowners","Give Greater Power To An English Ruler","Establish An English Monarchy","Place Limits On An English Ruler's Power."
"what is the fear of birds called?","Arachnophobia","Closterphobia","There's No Such Thing","Orinthophobia"
"what is the name of earths parent star?","Alpha Centauri","Proxima Centauri","Orion","The Sun"
"what is the only countrygroup of people to successfully invade and take over the whole country of russia?","Prussia","Japan","Poland","Mongolia"
"how many spirits including jacob marley visit ebenezer scrooge in charles dickens a christmas carol?","6","2","3","4"
"what is the cure for the flu?","Amoxicillin","Penicillin","Antifungal","There Is No Cure"
"which country was ruled by england for hundreds of years before their independence in 1948?","Indonesia","Rhodesia","Kenya","India"
"in albert einsteins equation what equals mc2?","H","Cl","O","E"
"on a 30 television what measurement does the 30 refer to?","Vertically Across The Screen","Horizontally Across The Screen","How Far Away To Sit When Watching","Diagonally Across The Screen"
"how many points do you get in a basketball game from the half court line?","1","2","6","3"
"in the nba who has never won the rookie of the year award?","Chris Paul","Wilt Chamberlain","Amare Stoudamire","Kobe Bryant"
"what commercial product claims to give you wings?","Gatorade","Five Hour Energy","Rock Stars","Red Bull"
"what is water composed of?","Iron And Phosphor","Potassium And Sodium","Carbon Dioxide And Cyanide","Hydrogen And Oxygen"
"what indicates a tropical climate?","Lots of rain","High temperatures","High humidity levels","All are correct"
"which song is not sung by tupac shakur?","Dear Mama","Only God Can Judge Me","California Love","Juicy"
"which is worth the least points in american football?","Touchdown","Field goal","Safety","Extra point"
"in the tv show frasier who did the character niles have a secret crush on for 7 seasons?","Maris","Roz","Mel","Daphne"
"what does icbm stand for?","Inconsistent Ballast Manifest","In Country Bombing Map","Inconsistent Biological Map","Inter Continental Ballistic Missile"
"what is the capital of the usa?","Seattle","Chicago","Washington","Washington D.C."
"which one of these elements is rare earth metal?","Gold","Platinum","Radium","Uranium"
"what type of toy did andy want for his birthday in the movie childs play?","Bike","Raggedy Ann","Skate Board","Good Guy Doll"
"which of the following is a nonrenewable energy source?","The Sun","Wind","Water","Fossil Fuels"
"when a horse wins the race what is draped over its neck?","Gems","Candy","Crowns","Flowers"
"what is kentuckys main agricultural export?","Sugar","Corn","Wheat","Tobacco"
"who had the largest medal tally in the sochi olympics 2014?","Usa","Germany","Norway","Russia"
"which epic hero defeated grendel and his mother?","Ragnar Lothbrok","King Arthur","Hereward the Wake","Beowulf"
"what device is not used to view distant objects?","Telescope","Binoculars","Opera Glasses","Microscope"
"what was the second continental congress most known for?","None of these","Constitution","Bill of Rights","Declaration of Independence"
"what was captain john smiths famous quote?","""Work Hard....Have Fun!""","""Work Hard!""","""Stay Strong!""","""Those Who Don't Work...Don't Eat."""
"what is the state capital of south dakota?","Bismarck","Rapid City","Sioux Falls","Pierre"
"who is the boy who never grows up?","Buddy The Elf","Tarzan","Jack Frost","Peter Pan"
"whos the head quarterback for the indianapolis colts according to the 2014 season?","Joe Griffin","Aaron Rodgers","Philip Rivers","Andrew Luck"
"in the united states where were the 13 original colonies located?","Pacific Coast","West Coast","South Coast","East Coast"
"what element of design is about roughness and smoothness?","Hue","Value","Space","Texture"
"what is the name of doras monkey?","Cookie","Puddles","Banana","Boots"
"which of these people invented psychoanalysis?","Albert Einstein","Louis Pasteur","Socrates","Sigmund Freud"
"what is the most important thing that a tree provides?","Nut Trees","Paper","Fruit Trees","Oxygen"
"which planet is not named after a roman god?","Neptune","Jupiter","Mars","Earth"
"the climate of costa rica?","Is Desert Like","Is Identical To The Climate Of The U.S.","Is Snowy And Mountainous","Is That Of A Rainforest"
"in catholicism what is the shape of the ashes placed on the forehead that signifies the beginning of lent?","Blob","Dot","Heart","Cross"
"what u s president was supported by the tag line we like ike?","Lyndon B. Johnson","Jimmy Carter","Richard Nixon","Dwight D. Eisenhower"
"clown fish are typically hosted by what sea creature?","Shrimps","Corals","Clams","Anemones"
"what element was kryptonite based off of?","Helium","Mercury","Peanut Butter","Krypton"
"which was the first defeat of hitler in russia?","Moscow","St Petersburg","Warsaw","Stalingrad"
"in biology what do you call the relationship between organisms that benefits one but hurts the other?","Hosting","Mutualism","Commensalism","Parasitism"
"in what city is the alamo located?","Alamo City","Waco","Vast Top","San Antonio"
"what novel included a ship by the name of the pequod?","Treasure Island","Of Mice And Men","Hunger Games","Moby-Dick"
"what is the correct name of this child focused entertainment franchise?","Chuckie Cheese's","Chucky Cheese's","Charles Cheddar's","Chuck E. Cheese's"
"which ethnicity is most likely to be affected by sickle cell anemia?","Caucasian","Asian American","Native American","African American"
"who was the first father and son combination to play in a major league baseball game?","Lenny Dykstra And Cutter Dykstra","Brett Boone And Aaron Boone","Mickey Mantle And Mickey Mantle Jr.","Ken Griffey And Ken Griffey Jr."
"what percent of americas population was killed in the civil war?","0.6%","3.1%","0.01%","2.5%"
"in lacrosse what is it called when you runsmash into other players on the field?","Run","Smash","Through","Charge"
"where is liberia?","Alleutian islands","An Austrian village","The Alaskan capital","Africa"
"in golf if you were to eagle a par 4 hole what would your score on the hole be?","6","3","5","2"
"what is the profession of david copperfield?","Musician","Dancer","Soccer player","Magician"
"on the x files what was agent dana scullys religion?","Branch Davidian","Wicca","None","Catholic"
"in chemistry what chart lists all of the elements?","Elemental Table","Chemist's Table","Pi Chart","Periodic Table"
"what is a pascal unit?","An Atmosphere Unit","A Hydraulic Object","A Law","A Measurement Of Pressure"
"where was president jimmy carter from?","Milwaukee, Wisconsin","Bensalem, Pennsylvania","Charleston, South Carolina","Plains, Georgia"
"what is the element with the symbol of h?","Helium","Hafnium","Halogen","Hydrogen"
"how was katniss everdeens father killed in the bestselling novel the hunger games?","None Of These, He Is Still Alive","Executed By Peacekeepers","Dead Hunger Games Tribute","Explosion In Coal Mines"
"who was the model for the mona lisa?","Queen Elizabeth","Mona Lisa","Mary Magdalyn","Nobody Knows"
"a cucumber is what percent water?","28.7%","57%","49%","96%"
"what city in western arabia was the birthplace of muhammad?","Syria","Jerusalem","Aden","Mecca"
"how many notes are in the pentatonic musical scale?","7","12","3","5"
"where is the lattisimus dorsi muscle located?","Chest","Arms","Legs","Back"
"where did u s president thomas jefferson live?","Philadelphia","Charleston","Washington D.C.","Monticello"
"which tragic event is featured on the debut album of english rock band led zeppelin?","The sinking of the Titanic","The 1906 San Francisco earthquake","An atomic bomb going off over Hiroshima","The burning of the Hindenburg"
"on written musicsheet music what are the horizontal lines the notes are written on called?","Treble","Clef","Rest","Staff"
"what is the national sports of the bahamas?","Track and field","Soccer","Tennis","Cricket"
"what is not a part of track?","Long Jump","Shot Put","High Jump","Bow And Arrow"
"joseph stalin was the leader of what country?","Germany","Poland","Spain","Russia"
"what is the practice of making ice statues called?","Ice scaping","Ice crafting","Ice masonry","Ice sculpting"
"who is michael vick?","Basketball Player","Swimmer","Runner","Football Player"
"what us cell phone carrier used to be called horizon?","At","Sprint","Alltel","Verizon Wireless"
"what artist painted the piece red vineyard?","Pablo Picasso","Edward Munch","Michelangelo","Vincent Van Gogh"
"which of these metals is non reactive?","Silver","Titanium","Iron","Gold"
"what nation helped the american colonies defeat the british in the battle of yorktown?","Spain","China","Mexico","France"
"in 2015 howard stern has been judge alongside heidi klum mel b and howie mandel on which popular talent show?","American Idol","American Ninja Warrior","America's Next Top Model","America's Got Talent"
"what is a clavicle?","A Fingernail","A Rib","A Throat Muscle","A Collarbone"
"who wrote the harry potter books?","Nicholas Sparks","John Green","Steven King","J.K.Rowling"
"the creators of the simpsons also created which show?","The Big Bang Theory","Naruto","Two and a Half Men","Futurama"
"how many trimesters are there in a full term pregnancy?","4","2","1","3"
"in the fast and the furious series what is dom torettos preferred beer?","Budweiser","Stella Artois","Coors","Corona"
"what is the worlds smallest country?","Djibouti","Lichtenstein","Albania","Vatican City"
"what number is a neutral ph?","14","3","6","7"
"in what year did east germany begin construction of the berlin wall?","1941","West Germany Built It","1989","1961"
"what item was made on accident?","Reese's","Camera","Chair","Superglue"
"who won the civil war in china?","Muslims","Nationalists","Hindus","Communists"
"what is the movable section that can open and close a circuit?","Battery","Light Bulb","Connecting Wire","Switch"
"which mexican food contains chocolate red peppers and other spices?","Enchiladas","Tacos","Tamales","Mole"
"on what continent would you find the acropolis of athens?","Africa","Asia","South America","Europe"
"tornado alley an area of the united states that experiences tornados at unusually high frequencies is located in what region?","Northeast","South","West","Midwest"
"what is the symbol for silver?","Av","Sl","Lv","Ag"
"who discovered white light is composed of colours?","Galileo Galilei","Charles Darwin","Albert Einstein","Isaac Newton"
"on what college campus were 4 students shot by national guardsmen during a political protest in 1970?","Ohio State","Berkeley","Dartmouth","Kent State"
"who is well known for their altercations with photographers?","John Travolta","Brad Pitt","Leonardo Dicaprio","Alec Baldwin"
"what is the approximate weight of an adult humans brain?","3 Ounces","10 Pounds","10 Ounces","3 Pounds"
"who directed star wars episode v the empire strikes back?","Steven Spielberg","George Lucas","J.J. Abrams","Irvin Kershner"
"what is measured by the richter scale 2?","Hurricanes","Tornadoes","Wind Speeds","Earthquakes"
"what is the plague of justinian more commonly known as?","The Spanish Flu","Smallpox","Measles","The Black Death"
"who was the eighteenth president?","Luke Bryan","George Washington","Thomas Edison","Ulysses S. Grant"
"the patagonia region can be found across which two countries?","Chile","Argentina","Argentina","Chile"
"what is the contrasting color of red?","Purple","Blue","Pink","Green"
"which mlb team won the 2011 world series?","The Rockies","The Cubs","The Rangers","The Cardinals"
"who was the leader of the army of 300?","Napoleon","Prometheus","Hercules","Leonidas"
"what was the main disease that scientists believe to have caused the black death?","Diphtheria","Cholera","Smallpox","Bubonic Plague"
"what form of poetry follows a specific pattern of syllables?","Acrostic","Free Form","Ode","Haiku"
"what position in soccer do you save shots with your hands?","Midfielder","Forward","Defender","Goalkeeper"
"in what sport do you use a broom?","Football","Soccer","Rugby","Curling"
"2 cubed raised to the third power is equal to what?","4","6","10","8"
"what are flags designed for boats or ships usually called?","Jolly Rogers","Victory Flags","Pennants","Maritime Flags"
"what does a chameleon have that is 1 5 times the length of its body?","Tail","Claws","Eyes","Tongue"
"which us state has the largest population?","Florida","Texas","New York","California"
"which of the following is not considered a fine art?","Sculpting","Painting","Drawing","Embroidery"
"what type of scientist would study fossils and dinosaurs?","Entomologist","Astronomer","Geologist","Paleontologist"
"in curling who throws the first rock?","Second","Third","Skip","Lead"
"where is scarface from?","Italy","Puerto Rico","Malta","Cuba"
"what film did jodie foster not star in?","Bugsy Malone","The Silence of the Lambs","The Accused","Road House"
"in the book a christmas carol by charles dickens what does the ghost of christmas past have atop its head?","A Cap","A Crown Of Holly","A Hood","A Flame"
"which famous painter is known for creating cubism?","Claude Monet","Amedeo Modigliani","Francisco Goya","Pablo Picasso"
"what atomic project was orchestrated without the knowledge of anyone in the country during the time of war?","A-Bomb Project","Brooklyn Project","Blow Up Bomb Project","Manhattan Project"
"where did ebola break out?","Antartica","Australia","Siberia","Africa"
"what bay was otis redding singing about when he was sitting in the morning sun?","Guantanamo Bay","Cisco Bay","Bay Of Pigs","Frisco Bay"
"what was the first food eaten in space?","Beef Stew","Mashed Potatoes","Jello","Applesauce"
"which of the following involved oompa loompas?","The Wizard Of Oz","Harry Potter And The Cheesecake Factory","Where's Waldo?","Willy Wonka And The Chocolate Factory"
"which of these civilizations did not build huge pyramids?","Egyptian","Aztec","Mayan","Indus"
"what is indiana jones job?","Philosopher","Prison Warden","Journalist","Archaeologist"
"who was marie antoinette 2?","Queen of Spain","Madame de Pompadour","The Red Queen","Queen of France"
"what is the hallmark of wwi?","First Cameras Used","Guerrilla Tactics","Atomic Bombs","Trench Warfare"
"who was known by their nom de plume voltaire?","Paul Verlaine","Alfred De Musset","Jim Morrison","Franois-Marie Arouet"
"where is volvo group headquarters?","Norway","Germany","France","Sweden"
"when you cut a once living organism what are you doing the scientific term?","Cutting","Digesting","All Of These Answers","Dissecting"
"what animal does not eat meat?","Tiger","Lion","Bear","Cow"
"peyote contains mescaline a hallucinogenic drug where is it obtained?","Coyote Pee","Tree Sap","Snake Venom","A Cactus Plant"
"in what province of canada is the city of montreal?","Ontario","Nova Scotia","Alberta","Quebec"
"who created the painting the scream?","Pablo Picasso","Leonardo Da Vinci","Andy Warhol","Edward Munch"
"in professional baseball where are cactus league games played?","Texas","California","Colorado","Arizona"
"hans zimmer is known for his what?","Sculptures","Paintings","Writings","Scores"
"which painter mutilated his ear after staying in a mental health facility?","Chagall","Monet","Picasso","Van Gogh"
"what are the two most recently added states?","Hawaii And Texas","Alaska And Puerto Rico","Puerto Rico And Hawaii","Alaska And Hawaii"
"what is a drum major?","A Person Who Majors In Drums","A Percussion Instructor","A Person Who Cheers A Marching Band","A Person Who Leads A Marching Band"
"how many lives are cats rumored to have?","Ten","Three","Two","Nine"
"in baseball when is the infield fly rule in effect?","Less Than 2 Out","Runners On First And Second","Runners On First, Second","All Are Correct!"
