"which u s city boasts the national civil rights museum 90 year old peabody hotel and elvis graceland?","Montgomery, AL","Nashville, TN","Birmingham, AL","Memphis, TN"
"which country is the origin of pizza?","Spain","France","Greece","Italy"
"which artist is famous for creating abstract art with paint splatters?","Andy Warhol","Pablo Picasso","Georgia O'keeffe","Jackson Pollock"
"which is not a real position in football?","Cornerback","Tight End","Quarterback","Touchdown Runner"
"who was christopher lee?","A Doctor","A Dentist","An American Actor","A British Actor"
"what is the collar bone called?","Sternum","Scapula","Sacrum","Clavicle"
"what part of the famous egyptian sculpture the sphinx is missing?","A Toe","The Tail","An Ear","The Nose"
"in which sport do you mainly have to throw balls and dodge them?","Football","Volleyball","Basketball","Dodgeball"
"which us president authorized the two nuclear bombs to be dropped on hiroshima and nagasaki in 1945?","John F Kennedy","Richard Nixon","Franklin Roosevelt","Harry Truman"
"what is the name of the championship for major league baseball?","The Finals","World Cup","The Super Bowl","World Series"
"what car company was established in 1899 in torino italy?","Chevy","Buick","Volkswagen","Fiat"
"which movie did molly ringwald not act in?","The Breakfast Club","16 Candles","Pretty In Pink","Clueless"
"which of the following is not a character name from harry potter?","Dudley","Hermione","Ron","Tywin"
"which country invented soccer cricket and tennis?","Australia","Scotland","Wales","England"
"what do carbohydrates break down into?","Carbs","Amino Acids","Enzymes","Simple Sugars"
"in what state does the macys thanksgiving day parade take place in?","California","New Jersey","Florida","New York"
"who performed the song stairway to heaven?","Eric Clapton","Bob Seger","The Doors","Led Zeppelin"
"which baseball team won three straight world series titles from 1998 2000?","Giants","Red Sox","Cardinals","Yankees"
"who of these characters of the series the big bang theory does not have a ph d?","Rajesh Kouthrapali","Sheldon Cooper","Leonard Hoefstader","Howard Wolowitz"
"what is the only kind of deer whose females have antlers?","Chinese Water Deer","Mule Deer","White-Tailed Deer","Reindeer"
"when you sterilize a female dog what is the process called?","Both","Neutering","Neither","Spaying"
"what are the detroit pistons named after?","A French Capital","An Expression Of Anger","A Mythical Creature","Part Of An Engine"
"in the phonetic alphabet the word for the letter m is?","Mister","Motel","Mayham","Mike"
"from what language did the word trivia originate?","Greek","Roman","Portuguese","Latin"
"which of these diseases is noncommunicable?","Flu","Cold","Virus","Cancer"
"how many different colors of armies are there on a risk game?","8","10","9","6"
"which us military officer led the fight at the battle of little bighorn?","Robert Edward Lee","Ulysses S. Grant","Dwight David Eisenhower","George Armstrong Custer"
"who is the filmmaker whose wife was savagely executed by the notorious murderer charles manson?","Peter Jackson","Christopher Nolan","Stanley Kubrick","Roman Polanski"
"which gymnastics olympian made history for being the first african american gymnast to win gold at the olympics?","Mary-Lou Renton","Kari Stroug","Aly Raismen","Gaby Douglas"
"what are drifting microscopic plant like marine organisms called?","Seaweed","Zooplankton","Nekton","Phytoplankton"
"vulcanology glaciology and seismology are sub studies of which science?","Chemistry","Physics","Astronomy","Geology"
"when a scale is adjusted for accuracy it is?","Coordinated","Co-oberated","Aligned","Calibrated"
"what animal attacked magician roy horn of siegfried?","Rajah, The Cobra","Tony, The Tiger","Jumbo, The Elephant","Mantecore, The Tiger"
"who wrote the shining?","Dan Brown","William Faulkner","John Grisham","Stephen King"
"what is the name of the path the native americans took out of the eastern united states during 1838 1839?","Silk Road","Mississippi River","The Louisiana Purchase","Trail Of Tears"
"which country introduced tempura to japan in the sixteenth century?","Spain","Italy","France","Portugal"
"which of these sitcoms is set in seattle?","Cheers","Friends","Two And A Half Men","Frasier"
"which city has the largest population in the world?","New York City","Beijing","Mexico City","Tokyo"
"which stringed instruments is typical of tahiti?","Guitar","Violin","Bass","Ukulele"
"sherlock holmes was extremely talented at what skill?","Seduction","Induction","Reduction","Deduction"
"what is p e short for?","Personal Education","Personal Emergency","Physical Emergency","Physical Education"
"which sport is played mostly with your feet in the usa?","Football","Baseball","Tennis","Soccer"
"who are the bad guys in the game angry birds?","Cats","Dogs","Vultures","Pigs"
"what soft drink once used the slogan up yours?","Pepsi","Coca-Cola","Tab","7-Up"
"how many men in george bushs family have been elected president?","6","1","3","2"
"where are kangaroos typically from?","Usa","Africa","Mexico","Australia"
"who replaced jay leno at the tonight show in 2014?","David Letterman","Ellen DeGeneres","Justin Timberlake","Jimmy Fallon"
"which basketball player stars in gold bond commercials?","Lebron James","Kobe Bryant","Michael Jordan","Shaquille O'neal"
"what constellation is nicknamed the hunter?","Andromeda","Pegasus","Leo","Orion"
"which is not a us state?","Alaska","Maine","New York","Ontario"
"which sport requires a pitcher batter basemen and umpire?","Soccer","Basketball","Football","Baseball"
"in the sitcom wkrp in cincinnati what did they throw out of a helicopter for a thanksgiving day promotion?","Pecan Pies","Cincinnati Bengals Football Tickets","Lots And Lots Of Money","Live Turkeys"
"what is the intruding pathogen in leprosy disease?","Virus","Fungi","No Pathogen, It's An Auto-Immune Disease","Bacteria"
"where is pittsburgh?","Montana","Texas","Montreal","Pennsylvania"
"what does an owl symbolize?","Nothing","Love","Night/Sleep","Wisdom"
"what is a perfect score in a gymnastic event?","5","7","25","10"
"in inside outwhich emotion is born first when riley opens her eyes for the first time?","Sadness","Anger","Disgust","Joy"
"what does dna stand for hint dna is not necessarily 3 seperate words?","Diribose (2) Negative Acid","Di-Nitrose (2) Atoms","Dexose-Ribonomal Acid","Deoxyribonucleic Acid"
"what piece of clothing did o j simpson have to try on during his trial?","A Sock","A Shirt","A Hat","A Glove"
"which of the following is not a french painter?","Edgar Degas","Paul Czanne","Claude Monet","Robert Goutin"
"in the minions movie what are the names of the three main minions?","Luke, Kenny, Bob","Bob, Dylan, Marley","Bob, Stuart, Dave","Bob, Kevin, Stuart"
"what was the name of the god of blacksmiths?","Hermes","Ares","Apollo","Hephaestus"
"what country does poland border?","Finland","Spain","Turkey","Germany"
"what kind of colors are impossible to create by mixing together other colors?","Ultra Colors","Secondary Colors","Alpha Colors","Primary Colors"
"how many minutes is the penalty for fighting in ice hockey?","1","2","15","5"
"what form of art requires the use of a spray paint can?","Abstract","Mosaic","Portraits","Graffiti"
"which is a real species of shark?","Bug Eyed Shark","Blue Black Shark","Razor Fin Shark","Goblin Shark"
"what is the only country that is also a continent 2?","Africa","Europe","Asia","Australia"
"what state has the largest border with mexico?","California","Arizona","New Mexico","Texas"
"what nationality is michael phelps?","English","Irish","Mexican","American"
"what is the largest country in the caribbean?","Haiti","Dominican Republic","Puerto Rico","Cuba"
"what is the predominant architectural form in don quixote?","Castles","Towers","Wells","Windmills"
"what sport involves a birdy racket and a net?","Tennis","Volleyball","Soccer","Badminton"
"in the movie fargo what was used to render the murder victim unrecognizable?","Lye","Acid","Axe","Wood Chipper"
"what sport is maria sharapova famous for?","Football","Basketball","Volleyball","Tennis"
"in which city is the series dexter set?","New York","New Orleans","Orlando","Miami"
"what doctor specializes in cancer?","Gynecologist","Pediatrician","Urologist","Oncologist"
"what country is neighbors to syria israel and connects to the mediterranean sea?","Oman","Jordan","Cyprus","Lebanon"
"what president said what counts is not necessarily the size of the dog in the fight its the size of the fight in the dog?","John Adams","George Washington","F.D.R","Dwight D. Eisenhower"
"which novel is written by an american author?","Canterbury Tales","Frankenstein","War And Peace","The Call Of The Wild"
"in the x men franchise what is wolverines first name?","Erik","Charles","Scott","Logan"
"when you cross a poodle and a golden retriever you get what?","Golden Pretriever","Golden Poodle","Golden Roodle","Golden Doodle"
"which of these artists set a record for the highest price ever paid for a painting?","Andy Warhol","Claude Monet","Salvadore Dali","Pablo Picasso"
"in basketball what is the maximum number of points you can score in one shot without getting fouled?","4","1","2","3"
"in the medical drama house what drug was dr house addicted to?","Heroin","Ibuprofen","Cocaine","Vicodin"
"what is taxonomy the study of?","Choices","Life","Medicine","Classification"
"who is the author of charlie and the choclate factory?","Brown Re","Mem Fox","Enid Blyton","Roald Dahl"
"what does pg mean in basketball?","Points Guarded","Player Guarded","Plays Guarded","Point Guard"
"what body of water is often associated with buffalo ny in reference to its lake effect snow?","Atlantic Ocean","Mississippi River","Lake Titicaca","Lake Erie"
"which greek god is the lord of the underworld?","Athena","Hermes","Zeus","Hades"
"which us state has nearly straight borders and resembles a rectangle?","Texas","Florida","Massachusetts","Wyoming"
"who is not an actor of the tv series the big bang theory?","Johnny Galecki","Jim Parsons","Simon Helberg","Jennifer Aniston"
"which french general helped the american colonies win the american revolution?","Baron Von Steuben","George Washington","Rochambou","Marquis De Lafayette"
"what is a foot fault in tennis?","Stepping on your opponent's foot","Playing bare footed","Kicking the ball with your foot","Touching the baseline while serving"
"which of these was not a dwarf to accompany bilbo in the hobbit?","Oin","Bombur","Balin","Gimli"
"what is the formula to find speed?","Distance/Rate","Time/Distance","Speed/Time","Distance/Time"
"which dinosaurs name translates to king of the tyrant lizards?","Seismosaurus","Apatosaurus","Camarasaurus","Tyrannosaurus Rex"
"what is the birth country of racing legend mario andretti?","USA","Canada","Spain","Italy"
"where is bolivia located?","North America","Asia","Africa","South America"
"what do you add in order to balance out a chemical equation?","Subscripts","Superscripts","Periods","Coefficients"
"in 1976 which computer company was founded?","Microsoft","Ibm","Google","Apple"
"when plants collect water sun light and nutrients they use those substances for a process what is that process?","Chlorophyll","Erosion","Hydrophilic","Photosynthesis"
"what candy bar catch phrase begins with give me a break give me a break break me off a piece of that?","Milky Way Bar","Musketeers Bar","Hershey Bar","Kit Kat Bar"
"what does add stand for?","Alert Doctrine Disorder","Alum Dextral Disease","Adventurous Dimpled Dog","Attention Deficit Disorder"
"what is the thing that makes a chemical process go faster?","Spines","Header","Scepter","Catalyst"
"who kills the character javert in the musical les miserables?","Enjolras","Jean Valjean","Cosette","He Kills Himself"
"what year did world war 1 start?","1907","1906","1908","1914"
"this mountain chain in the eastern us is one of the oldest in the world?","Rocky","Alps","Carpathian","Appalachian"
"what nationality is the main character in life of pi?","Chinese","Egyptian","French","Indian"
"which states standard license plate reads garden state?","Maine","Vermont","Missouri","New Jersey"
"what is the best hit in baseball that will get you the most runs?","Strike out","Out of the park","Home run","Grand slam"
"what document was written in 1215 and limited the power of the king?","Twelve Tables","Limitation Statute","Agrarian Law","Magna Carta"
"the aushwitz concentration camp is closest to which of the following?","St Petersburg","Rome","London","Krakw"
"what colors are mixed to get violet?","Blue and Green","Green and Black","Red and Green","Blue and Red"
"what team doesnt play for detroit 2?","Red Wings","Tigers","Lions","Browns"
"which is not one of the themed lands in disneys magic kingdom?","Adventure Land","Tomorrow Land","Fantasy Land","Lego Land"
"how many fast and furious movies are there as of 2015?","8","5","6","7"
"who discovered that atoms have most of their mass in a tiny dense nucleus?","Chadwick","Bohr","Millikan","Rutherford"
"on august 21st 1911 what famous painting was stolen from the louvre?","The Last Supper","Girl With A Pearl Earring","The Scream","The Mona Lisa"
"who kills elizabeth in frankenstein?","Victor","William","Justine","Frankenstein's Monster"
"to whom is the creation of calculus attributed to?","Johann Gauss","Isaac Newton","Johann Gauss","Isaac Newton"
"which of the following determines a snowflakes shape?","Location","Wind speed","None of the above","Temperature"
"what causes the holes in swiss cheese?","Rotten Milk","Mice","A Machine Punches Them","Air Bubbles"
"according to legend who were romulus and remus raised by?","Their Step-Mother","Their Mother","A Goddess","A She-Wolf"
"what american city is often referred to as music city?","Salt Lake City, Utah","New York City, New York","New Orleans, Louisiana","Nashville, Tennessee"
"who is the author of the books paper towns and looking for alaska?","Gayle Forman","Nicholas Sparks","Morris Gleitzman","John Green"
"where is the congo?","Australia","New Jersey","Portugal","Africa"
"what is it called when you use a series of words that start with the same letter?","Abbreviation","Rhyming","Onomatopoeia","Alliteration"
"a blue moon typically occurs?","Once In A Blue Moon","Once A Century","Never","Every Two Or Three Years"
"who did john lennon marry in 1969 that supposedly broke up the beatles?","Liza Minelli","Stevie Nicks","Janis Joplin","Yoko Ono"
"how many dots are on two die?","44","58","38","42"
"in theater stage left refers to?","The Audience's Left","The Actor's Right","The Audience's Rear","The Actor's Left"
"what do jesse owens and bob beamon have in common?","Both Wrote Controversial Novels","Both Won The Heisman Award","Both Scored Over 60 Points In A Game","Both Held The World Long Jump Record"
"what does the di in carbon dioxide mean?","10","Evaporating","Liquid","2"
"what is the city of chicago known as?","The Party City","The Train City","The Big City","The Windy City"
"which luxury car company was created after the founder was insulted by the owner of ferrari when he lodged a complaint about one of the cars?","Mercedes","Chevrolet","Maserati","Lamborghini"
"in the movie toy story 3 what is the name of the lead villain?","Chuckles","Mr Prickle Pants","Sid","Lots-O'-Huggin Bear"
"which one of these phrases would complete the following head over?","Knees","Shoulders","Eyes","Heels"
"which of these countries has the largest current jewish population by percentage of its total population?","Usa","France","Canada","Israel"
"which art technique is created with tiny dots?","Collage","Dottism","Etching","Pointillism"
"where was game of cricket created?","Bangladesh","Australia","South Africa","England"
"who plays captain philips?","Brad Pitt","Charlie Sheen","Tom Curie","Tom Hanks"
"what does rbc stand for?","Red Bone Cells","Rough Blue Cells","Red Big Cells","Red Blood Cells"
"which of these countries is not bordered by macedonia?","Serbia","Kosovo","Albania","Croatia"
"whose personal cell phone number did donald trump release to the public during a speech on july 21 2015?","John Mccain","Barack Obama","Jeb Bush","Lindsey Graham"
"what was president eisenhowers middle name?","Darrell","Dwane","Dean","David"
"which of the following was no longer designated as an illness by the who in 1990?","Insomnia","Allergy","Cornea","Homosexuality"
"in which country did the largest recorded earthquake in the world occur?","Japan","United States","Indonesia","Chile"
"which of the following south american countries is land locked?","Venezuela","Uruguay","Peru","Paraguay"
"in baseball what is it called when the batter hits the ball outside of the white line?","Strike","Home Run","First Base","Foul"
"which of the following countries has never been visited by james bond?","Monaco","Austria","Bolivia","Canada"
"what ingredient would be needed for a fondue?","Yoghurt","Vodka","Garbanzo Beans","Cheese"
"what wood are most baseball bats made of?","Oak","Pine","Maple","Ash"
"what sport has the greatest number of youth participants in the usa?","Baseball","Basketball","Football","Soccer"
"what is the name of the famous cartoon rabbit that usually says eh whats up doc?","Trix Rabbit","Frank Rabbit","Lola Bunny","Bugs Bunny"
"what is the freezing point of water in celsius degrees?","100'","-12'","32'","0'"
"why did the united states make the gadsden purchase?","Spain Was Giving It Away Cheap","Manifest Destiny","Gold Was Found In This Land","For A Railroad"
"which of the following is not a professional golfer?","Jason Day","Jordan Speith","Rickie Fowler","Jim Kelly"
"burma is also referred to as?","Bhutan","Laos","Nepal","Myanmar"
"what do you apply to the end of a pool cue before you shoot?","Wax","Glue","Soap","Chalk"
"what figure of speech is exaggerating things?","Personification","Simile","Irony","Hyperbole"
"what controls the blurriness of the background in a photo?","Shutter Speed","Exposure","F Stop","Depth Of Field"
"how many nfl teams are in texas?","3","4","None","2"
"according to the famous german conductor hans von bulow the three bs refer to which three composers?","Bruckner, Bach, And Brahms","Bach, Brahms, And Barber","Berlioz, Bartk, And Bernstein","Bach, Beethoven, And Brahms"
"in the cartoon rugrats what are the names of the twin babies?","Phillip and Gillian","Phillip and Mary","Phillip and Phillipa","Phillip and Lillian"
"what is the name of the person who hosted the game show the price is right for the longest time span?","Richard Dawson","Ray Combs","Steve Harvey","Bob Barker"
"in softball how many bases are there excluding home plate?","4","5","2","3"
"in which 4 major cities does fashion month take place?","New York, London, Paris, Tokyo","New York, Milan, Hong Kong, Sydney","New York, Paris, Tokyo, Sao Paulo","New York, London, Milan, Paris"
"which of these characters is not part of the mystery gang?","Fred","Velma","Shaggy","Bobby"
"which is not part of a snowboard?","Bindings","Board","Leash","Grip Tape"
"who plays peter vinkman on ghostbusters?","Channing Tatum","Tony Depp","Justin Bieber","Bill Murray"
"which general vowed to go back to the philippines?","Patton","Eisenhower","Montgomery","Macarthur"
"whats 11 squared?","112","111","101","121"
"which one is not an olympic sport?","Badminton","Marathon","Shotput","Squash"
"what is the symbol for the element carbon?","Bi","K","Co","C"
"which of the following is a form of a genetic disorder that has to do with an extra 21st chromosome?","Huntington's Disease","Fibromyalgia","Hemophilia","Down's Syndrome"
"what part of the body is considered to be a bust sculpture?","Full Body","From The Waist Up","From The Shoulders Down","From The Shoulders Up"
"which of the following is not part of the four nucleobases of dna?","Cytosine","Guanine","Adenine","Uracil"
"who was recognized as one of julius caesars murderers?","Octavian","Augustus","Mark Antony","Brutus"
"which is not an asian capital?","Manila","Phnom Penh","Bandar Seri Begawan","Buenos Aires"
"keratin is found in which structure?","Kneecap","Teeth","Nasal Bone","Fingernails"
"if you are going 60 miles per hour how long will it take to reach 180 miles?","2 Hours","1 Hour","1/2 Hour","3 Hours"
"what american muscle car was released by ford in 1964?","Challenger","Camaro","Ford Gt","Mustang"
"when did israel occupy the west bank golan heights sinai peninsula and gaza strip?","1900","1948","1916","1967"
"the eiffel tower is located in what famous french city?","Morocco","Nice","Lyon","Paris"
"what is it called when a cell commits cell suicide?","Mitosis","Replication","Synthesis","Apoptosis"
"where did pablo picasso come from?","England","France","Italy","Spain"
"which of the following comedy giants are canadian?","Jim Carrey","Mike Meyers","Seth Rogen","All Answers Are Correct!"
"who was the first african american female on a sports illustrated cover?","Cheryl Miller","Wilma Rudolph","Lisa Leslie","Althea Gibson"
"in which city was the first csi tv series set?","Los Angeles","New York","Miami","Las Vegas"
"on tvs the big bang theory what does sheldon do when someone is upset?","Give Them A Hug","Let Them Sit In His Spot","Let Them Sleep Over","Serve Them A Hot Beverage"
"in the sitcom seinfeld which main character never had an inner monologue in the series?","George","Elaine","Jerry","Kramer"
"why did john hancock sign his name so big on the declaration of independence?","Unknown","""To Be Better Than Everyone""","""Because He Wanted To""","""So The King Could See Without Glasses"""
"the space race involved which two countries?","China And India","Us And China","China And Japan","Us And The Soviet Union"
"what is considered to be the foundation of all dance?","Jazz","Hip Hop","Lyrical","Ballet"
"what are the other continents besides north america and south america?","Africa, Europe, Russia, Africa,","Antarctica, The North Pole, And Denmark","There Are Only 2 Continents","Africa, Asia, Europe,Antarctica, Australia"
"what is the least amount of points you must win by to win a volleyball match?","One","Three","Half","Two"
"in which galaxy is our solar system found?","Andromeda Galaxy","Sunny Galaxy","Galaxy M 1922","Milky Way Galaxy"
"which singer recently made an album titled her birth year?","Katy Perry","Nicki Minaj","Ariana Grande","Taylor Swift"
"who hosted the 87th oscars?","Jimmy Fallon","Carrie Underwood","Taylor Swift","Neil Patrick Harris"
"what is hippopomonstresquipedaliophobia?","The Fear Of The Dark","The Fear Of Spiders","The Fear Of Flowers","The Fear Of Long Words"
"how do prisms work?","Light Bounces Off Color","Light Magically Appears","The Rainbow Becomes Less Invisible","Light Is Refracted And Colors Appear"
"wheres the prudential center in massachusetts?","Cambridge","Alton","Salem","Boston"
"which is not considered a grand slam tournament in professional tennis?","French Open","U.S. Open","Australian Open","Canadian Open"
"when did alcatraz island cease being used as a federal prison?","1903","1933","2013","1963"
"which nfl team lost four straight super bowls?","Cleveland Browns","Detroit Lions","Philadelphia Eagles","Buffalo Bills"
"which of the five senses does the word ocular refer to?","Sound","Taste","Smell","Sight"
"what is another term for fat?","Saturation","Carbohydrates","Chloroplasts","Lipids"
"what is 2 squared?","8","2","6","4"
"who invented lightposts?","Leonardo da Vinci","Thomas Jefferson","Thomas Edison","Ben Franklin"
"who voiced mickey mouse first?","Roy Disney","Wayne Allwine","Bret Iwan","Walt Disney"
"which president received the nickname trustbuster?","Grover Cleveland","Bill Clinton","Ronald Reagan","Theodore Roosevelt"
"what christian denomination were the monarchs of england before forming the church of england anglicanepiscopalian church?","Methodist","Lutheran","Baptist","Catholic"
"which u s state is the setting for the movie titled hoosiers?","Tennessee","Kentucky","Missouri","Indiana"
"shakespeares famous to be or not to be soliloquy is about hamlets contemplation of what?","Action Vs Inaction","Appearance Vs Reality","Horatio's Loyalty","Life Vs Death"
"who wrote the song bohemian rhapsody?","Kings Of Leon","Prince","Kenny G","Queen"
"where is spock from?","Star Wars","Matrix Triology","Dr. Who","Star Trek"
"which of these inventions is thomas alva edison not credited for?","Incandescent Lightbulb","Phonograph","Electric Motor","Television"
"in the book the outsiders how does johnny die?","Stab Wound.","Bullet Wound.","He Doesn't Die.","Burn Wounds."
"what ocean separates usa from portugal?","Arctic","Pacific","Indian","Atlantic"
"what food was introduced in 1941?","Wheaties","Ramen Noodles","Instant Macaroni","Cheerios"
"what do the colors red white and blue on a barber pole represent?","The American Flag","Haircuts, Hairstyles And Shaves","The Barber Union Seal","Blood, Bandages And Veins"
"what type of art was monet known for?","Abstract","Contemporary","Expressionism","Impressionism"
"what is the intruding pathogens type in diphteria?","Virus","Protozoa","Fungi","Bacteria"
"what is the name of the vocalist in the band led zeppelin?","Hendrix","Axl Rose","Mike","Robert Plant"
"what type of sport doesnt use a stick?","Lacrosse","Field Hockey","Ice Hockey","Football"
"in figure skating what jump has the highest level of difficulty?","Waltz","Lutz","Salchow","Axel"
"where is the most famous bicycle race in the world held each year?","Usa","Italy","England","France"
"which of these is not an island nation?","Vanuatu","Malta","United Kingdom","San Marino"
"how many points is a touchdown in football?","7","3","9","6"
"who were the main victims of the holocaust?","Nazis","Germans","Gypsies","Jews"
"in what city is the mall of america located?","Portland","New York","Tampa","Minneapolis"
