"what is the second most populous city in new york state?","Albany","Binghamton","Syracuse","Buffalo"
"which person is not a member of the beatles?","John Lennon","George Harrison","Paul Mcartney","Drew Fox"
"in the original vacation movie what was the name of the type of vehicle clark bought for the trip?","The Shaggin Wagon","Death Mobile","Bigfoot","The Family Truckster"
"what color and pattern shirt does waldo wear?","Black And White Checked","Black And White Striped","Red And White Polka Dot","Red And White Striped"
"what are the three basic types of tectonic plate boundaries?","Subduction, Insurgent, And Convergent","Compression, Tension, And Shearing","Twisting, Pushing, And Pulling","Divergent, Convergent, And Transform"
"in the 1950s hit tv series lassie what was the name of lassies owner?","Johnny","Jack","Tommy","Timmy"
"which is not a led zeppelin song?","Stairway To Heaven","Whole Lotta Love","Since I've Been Loving You","Comfortably Numb"
"who was the criminal responsible for the killings of sharon tate and six others in 1969?","Jack Ruby","Son Of Sam","Jack The Ripper","Charles Manson"
"how are string instruments typically made?","Machine","Factory","Genies","By Hand"
"which nba player leads the league in all time scoring?","Larry Bird","Michael Jordan","Lebron James","Kareem Abdul-Jabbar"
"who was the famous frederick douglass?","Jazz Artist","Major League Baseball Player","Civil War General","Abolitionist"
"how many days in a year?","369","368","265","365"
"what language do people speak in portugal?","Spanish","English","Italian","Portuguese"
"which component is not part of gymnastics?","Balancing beam","Floor","Bars","Pole vault"
"which act has appeared in las vegas?","David Copperfield","Siegfried","Penn","All of them"
"what person or people were believed to be the founders of rome?","Mars And Neptune","Julius Ceasar","Zeus","Romulus And Remus"
"what is stropping?","Milking a cow","Salting beef","Separating linseed oil","Sharpening razor with leather"
"ca stands for what element?","Carbon","Cadmium","Caesium","Calcium"
"what color is impossible to create by mixing other colors?","Green","Purple","Orange","Red"
"what position is not a member of a gourmet restaurants kitchen staff?","Saucier","Sous-chef","Head Chef","Sommelier"
"koala a marsupial native to australia is most closely related to which other animal?","Fox Squirrel","Black Bear","Panda","Kangaroo"
"in what year did the nba adopt the 3 pointer?","They Have Always Had The 3 Pointer.","1980","1986","1979"
"in jeopardy what is the maximum amount of money available in a category in double jeopardy?","$1,200","$800","$1,600","$2,000"
"what western tv show always ended with the song happy trails to you?","Buffalo Bill","Howdy Doody","Mickey Mouse Club","The Roy Rogers Show"
"what animal represents the united states of america?","Turkey","Lion","Bear","Bald Eagle"
"the birthmark was written by?","Willia Cather","William Shakespeare","Robert Frost","Nathaniel Hawthorne"
"according to norse mythology who crafted thors hammer mjolnir and odins spear gungnir?","Loki","Ravens","Elves","Dwarves"
"which of the following elements has a glowing effect in the dark?","Mercury","Magnesium","Sulphur","Phosphorous"
"which phrase is spelled the same forward and backward?","Don't Put All Your Eggs In One Basket.","I Could Eat A House!","A Stitch In Time Saves Nine.","A Man, A Plan, A Canal: Panama"
"who participated in the ayala conference during wwii?","Neville Chamberlain","Barack Obama","Adolf Hitler","Winston Churchill"
"who is the famous sculptor of mount rushmore?","Doanne Robinson","Michaelangelo","Patrick Rushmore","Gutzon Borglum"
"which of these u s states was an original colony?","Illinois","Washington","None of these","New York"
"which one is a wrestler actor?","Kobe ""Black Mamba"" Brayant","Chuck ""The Iceman"" Liddell","Floyd ""Money"" Mayweather","Dwayne ""The Rock"" Johnson"
"which is not a colorado sports team?","The Nuggets","The Rockies","The Avalanche","The Dodgers"
"what movie has a fairy godmother that says bibbidi bobbidi boo?","Aladdin","Beauty And The Beast","Sleeping Beauty","Cinderella"
"what movie did heath ledger not star in?","Ned Kelly","Brokeback Mountain","The Dark Knight","Spider-Man"
"what is tom hanks friends name in castaway?","Bert","William","Tom","Wilson"
"new york citys juniors is famous for what dessert?","Chocolate Cake","Apple Pie","Strawberry Shortcake","Cheesecake"
"complete the lyric if you like pina coladas?","And going on holiday","And a glass of champagne","And walking down by the bay","And getting caught in the rain"
"which food items are mentioned in the song take me out to the ballgame?","None Of These","Peanuts","Hot Dogs","Peanuts"
"what disease specifically causes widespread chronic pain and fatigue?","Pnemonia","Liver Disease","Rhinovirus","Fibromyalgia"
"which state is south haven beach in?","None Of These","Connecticut","Massachusetts","Michigan"
"what is not allowed in basketball?","Layup","Dunk","Time out","Travel"
"what type of music did the famous italian composer giuseppe verdi mainly write?","Piano Solos","Concertos","Dubstep","Opera"
"in austin powers international man of mystery robert wagner plays which character?","Goldmember","Dr. Evil","Mr. Bigglesworth","Number Two"
"what is rihannas real name?","Rebecca","Kate","Loren","Robyn"
"what are lipids commonly called?","Sugars","Carbohydrates","Proteins","Fats"
"which organelle is the site of cellular respiration?","Vacuole","Nucleus","Ribosome","Mitochondria"
"what was the infamous attack on a hawaiian naval base called?","D-Day","Hamburger Hill","Bombshell Bay","Pearl Harbor"
"what was the most prominent american indian language during world war ii hint _____ code talkers?","Blackfoot","Lakota","Inuktitut","Navajo"
"wheres nebraska located?","Left Of Colorado","Below Florida","Below Maine","Above Kansas"
"which is not a volleyball serve?","Overhand Serve","Underhand Serve","Jump Serve","Bump Serve"
"in fashion what do the initials dkny stand for?","Denise King New York","Dylan Kwabs New Year","Donna Knight New Yorker","Donna Karan New York"
"what part of the plant do you eat when eating a radish?","Leaf","Stem","Flower","Root"
"who was assassinated by his fellow politicians?","Gaius Cassius Longinus","Caesar Agustus","Marcus Junius Brutus","Julius Caesar"
"what instrument is not a string instrument?","Violin","Cello","Viola","Bassoon"
"what is a simile in english literature?","A half-rhyme","Contradiction of 2 ideas","A happy mood given to a story","Comparision of 2 things using like or as"
"how many pre season nfl games count towards a teams final record?","1","2","4","0"
"how many holes are there in a tenpin bowling ball?","4","2","There Is No Such Thing","3"
"which disney movie contains a woman who starts off as a cartoon character then changes into a human?","Mulan","Mary Poppins","Snow White","Enchanted"
"what are the bones at the end of the fingers called?","Ulna","Metatarsals","Pubis","Phalanges"
"in music what does ff mean?","Very Soft","Moderately Loud","Moderately Soft","Very Loud"
"what is the name of the nerd girl on scooby doo who usually can solve the mystery?","Daphne","Scooby Doo","Mary","Velma"
"who plays ross in the u s tv sitcom friends?","Matthew Perry","Ross Lynch","Neil Patrick Harris","David Schwimmer"
"which is a city in austria?","Leipzig","Hesse","Dresden","Innsbruck"
"what color is not a part of the rainbow?","Violet","Indigo","Orange","Teal"
"what is it called in tennis when you throw the ball in the air and then hit it?","Volley","Rally","You Don't Throw The Ball Up And Hit It","Serve"
"where was the rapper drake born?","United States of America","Australia","United Kingdom","Canada"
"who was the captain of the starship enterprise in the original tv series?","Jean Luc Picard","Mr. Spock","Scotty","James T. Kirk"
"what is a seasonal seafood that you can use your feet and a pail to collect?","Grouper","Sea Urchins","Blue Crabs","Scallops"
"what is the process called that efficiently made iron into steel by removing carbon and other impurities?","De-Carbonating","Lessemer Process","Tessemer Process","Bessemer Process"
"how many words in the english language end in mt?","2","3","6","1"
"who was not one of the three amigos in the 1986 comedy?","Martin Short","Chevy Chase","Steve Martin","Dan Aykroyd"
"what is the nomenclature of silver chloride?","Sicl","Aucl2","Aucl","Agcl"
"who is not a character on tvs modern family?","Gloria","Luke","Manny","Hadley"
"what movie does not star reese whitherspoon?","Cruel Intentions","Legally Blonde","Sweet Home Alabama","Never Been Kissed"
"what is the common name for sodium hydroxide?","Panadol","Apple Juice","Crystal","Lye"
"who plays the drum for the bandthe beatles?","George Harrison","John Lennon","Paul Mccartney","Ringo Starr"
"where can you find the finest sand in the world?","Ko Samui, Thailand","Bali, Indonesia","Galpagos Islands, Ecuador","Whitsunday Islands, Australia"
"which of these singers does not have a book about them?","Lady Gaga","Cher","Madonna","Ke$Ha"
"the corrs is a band from what country?","UK","The Philippines","Canada","Ireland"
"what is the subject of the series the walking dead?","Vampires","A Serial Killer","The End Of The World","A Zombie Apocalypse"
"where is the scarlet letter worn?","The Forehead","Around The Wrist","On Back Of Hand","The Chest"
"in softball what is it called when the ball gets hit onto the ground directly in front of home plate?","Foul","Automatic Out","Pop-Up","Bunt"
"which of these men died in the alamo?","Benedict Arnold","Ulysses Grant","James Cromwell","Davie Crockett"
"which of the following is not a renaissance artist?","Leonardo Da Vinci","Raphael","Michelangelo","Claude Monet"
"what kind of art is made using simply pencil and paper?","Painting","Sculpture","Collage","Sketch"
"which of the following is an example of a metric system?","Miles","Feet","Fahrenheit","Meter"
"which of these alien species belongs to the star wars universe?","Vulcans","Klingon","Andorrians","Wookies"
"where do narwhals live?","Atlantic Ocean","Pacific Ocean","Antarctic Ocean","Arctic Ocean"
"what does the big bang theory explain?","Explosions","Combustion","Atomic Energy","Origins Of The Universe"
"which is not a move in basketball?","Travel","Shoot","Double Dribble","Spike"
"which usa city hosts the most famous american open wheel car race every year?","Talladega","Daytona","Los Angeles","Indianapolis"
"which organization was given the only nobel peace prize awarded during wwi?","World Health Organization","United Nations","European Union","International Red Cross"
"what does the term saignant mean?","Correct","Messy","Full","Rare"
"which three countries is german the first language?","Germany, Switzerland, Sweden","Germany, Austria, Sweden","Switzerland, France, Germany","Germany, Austria, Switzerland"
"who played the leading role of elphaba in the broadway musical wicked hint shes also the voice of elsa in frozen?","Michelle Federer","Kristin Chenowith","Lea Michele","Idina Menzel"
"which of these is not leonardo davincis painting?","Sunset At Dawn","Tulips Rising","Timing","Starry Night"
"in what sport do you use the terms ground stroke serve and follow through?","Badminton","Soccer","Basketball","Tennis"
"in what year did the original star wars movie premier?","1982","1970","1997","1977"
"who stars in the movie a bugs life?","Julia Louis-Dryfus","Kevin Spacey","Hayden Panettiere","All Of Them"
"which region of the human brain is responsible for sight?","Parietal Lobe","Amygdala","Hippocampus","Occipital Lobe"
"in order to digest the lactose in milk you need what enzyme?","Maltase","Sucrase","Lipase","Lactase"
"decipher the roman numerals mcxi?","111","1121","1100","1111"
"what is the first letter in the greek alphabet?","Kappa","Delta","Sigma","Alpha"
"what percentage of the world population is covered by china?","10%","27%","43%","19%"
"which historical icon said i am a soldier of peace?","Mother Therese","Jesus","Nelson Mandela","Mahatma Ghandi"
"which basketball player was in movie space jam?","Magic Johnson","Derick Rose","Kobe Bryant","Michael Jordan"
"which golden girl immigrated from sicily?","Blanche","Dorothy","Rose","Sophia"
"who painted the entombment?","Vincent Van Gogh","Leonardo Da Vinci","Monet","Michelangelo"
"what is the name of the phantom in the phantom of the opera?","Raoul","The Phantom","Gaston","Erik"
"what team is gabby douglas on?","African Team","Russian Team","None of the above","USA Team"
"what was the milwaukee baseball team directly before the brewers called?","Milwaukee Bees","Milwaukee Angels","Milwaukee Browns","Milwaukee Braves"
"which actor did not star in the movie the hangover?","Justin Bartha","Bradley Cooper","Ed Helms","Tom Green"
"what was the original eye color of all humans?","Green","Blue","Hazel","Brown"
"which asteroid is expected to come close to earths atmosphere in 2028?","Haumea","Ceres","Eris","Apothis"
"how many electrons can be on the lowest shell of an atom?","4","3","8","2"
"in pokemon what are pokemon caught in?","Nets","Pokebags","Cages","Pokeballs"
"who wrote federalist paper no 1?","John Jay","James Madison","Thomas Jefferson","Alexander Hamilton"
"what are countries like sweden and norway called?","African countries","Asian countries","Latin countries","Scandanavian countries"
"which sport involves a mallet?","Baseball","Soccer","Tennis","Croquet"
"which avengers character had a film made first?","Thor","Captain America","Iron Man","Hulk"
"which bone is located in the human thigh?","Brachial Bone","Thigh Bone","Tibial Bone","Femoral Bone"
"what group of elements has a full outer ring of 8 electrons?","Alkaline Earth Metals","Alkali Metals","Halogens","Noble Gases"
"which of the following is not a muscle?","Triceps","Biceps","Hamstrings","Triceratops"
"without intervention what helps set the prices of goods and services?","Production Costs","Cpi (Consumer Price Index)","Variable Costs","Supply And Demand"
"when participating in dressage what type of saddle does an equestrian use?","No Saddle-Bareback","Western","Welsh","English"
"what is michael jacksons best selling album?","Off The Wall","Dangerous","Xscape","Thriller"
"what is the 6th planet from the sun?","Earth","Jupiter","Mars","Saturn"
"what is the colloquial term for the latest new england patriots scandal?","Watergate","Spygate","Bradygate","Deflategate"
"from where did gunpowder originate?","Japan","Britain","Germany","China"
"what was dwight eisenhowers nickname?","Eisenshower","Old Dwight","David","Ike"
"what did the supreme court case roe v wade decide?","Separate But Equal Is Unconstitutional","Women Should Have The Right To Vote","Church And State Are Seperate","Abortion Is Legal"
"according to the book of exodus what was the tenth plague of egypt?","Flood","Locusts","Famine","Death Of Firstborn"
"which one is not a chemical element on the periodic table?","Francium","Germanium","Americium","Belgium"
"what is o3?","A Physics Theory","Oxygen","Worm Holes","Ozone"
"what measurement is used to measure a football field?","Meter","Feet","Length","Yard"
"who was the united states 2nd president?","James Madison","Thomas Jefferson","George Washington","John Adams"
"what instrument is made of mostly brass but is classified as a woodwind?","Trumpet","Drums","Clarinet","Saxophone"
"what do you call an outdoor game in which players use long handled sticks with nets for catching throwing and carrying the ball?","Hurling","Field Hockey","Golf","Lacrosse"
"dr seuss had a secret room full of what in his house?","Old Newspapers","Socks","Baseball Cards","Hats"
"which is a possessive pronoun?","There","Him","They're","Their"
"what color does starch turn when iodine is poured on it?","Green","Blue","Orange","Purple"
"sudan was colonised by?","France","Spain","Italy","The United Kingdom"
"how many official languages does hawaii have?","4","5","3","2"
"where is malagasy primarily spoken?","Malaysia","Mali","Mozambique","Madagascar"
"what famous greek poet is credited for creating the odyssey?","Agathon","Aristotle","Virgil","Homer"
"how many tour de france did lance armstrong win before getting them stripped away for cheating?","3","10","1","7"
"what part of your brain is connected to emotions?","Back","Occipital","Side","Frontal"
"what is the name of romeos best friend in william shakespeares play romeo and juliet?","Benvolio","Paris","Tybalt","Mercutio"
"which sport needs a server?","Football","Basketball","Bowling","Volleyball"
"which of the countries are not found in south america?","Brazil","Chile","Venezuela","Portugal"
"what is the hulks alter ego in avengers age of ultron?","Steve Rodgers","Tony Stark","Thor","Bruce Banner"
"what are the 3 rs of recycling?","Restart, Reboost","Remark, Retrade","Racoon, Rabbit","Reduce, Reuse"
"which french writer wrote the novel around the world in 80 days?","Phileas Fogg","Jacques Toulouse","Monique","Jules Verne"
"what is the biggest muscle in your neck?","Internal Jugular","Digastric","Thyrohyoid","Sternocleidomastoid"
"which of these is a state?","New England","Puerto Rico","East Carolina","West Virginia"
"where is andalusia?","Italy","Portugal","France","Spain"
"which tv show is based off the 1985 film featuring michael j fox?","Werewolves in London","Back to the future","Back to the future II","Teen Wolf"
"in despicable me what type of stuffed animal does agnes have?","Octopus","Butterfly","Pegasus","Unicorn"
"who is cupid also known as?","Erebus","Zeus","Zephyrus","Eros"
"what was veterans day originally called?","Military Day","Wars Day","Federal Day","Armistice Day"
"who wrote sonnet 113?","John Donne","Robert Herrick","Christopher Marlowe","William Shakespeare"
"who won the civil war in usa?","The Confederates","Great Britain","Spain","The Union"
"which is a novel by stephen king?","Roots","The Fault In Our Stars","Percy Jackson And The Lighting Thief","Misery"
"what foreign country is closest to alaska?","Russia","Iceland","Japan","Canada"
"what sport did michelle kwan play?","Tennis","Golf","Hockey","Figure Skating"
"what is geology?","The Study Of Maps","The Study Of Animals","The Study Of Light","The Study Of The Earth's Crust And Rocks"
"you are attacked by a black bear while hiking in the adirondack mountains where are you?","British Columbia","West Virginia","Colorado","New York"
"which of the following presidents was not assassinated while in office?","Abraham Lincoln","William Mckinley","James Garfield","Woodrow Wilson"
"what color is crimson a shade of?","Purple","Orange","Blue","Red"
"what river creates a border between new hampshire and vermont?","Charles River","Hudson River","Vermont River","Connecticut River"
"in abstract art the subject matter is?","Clearly Defined","Extremely Diverse","Not Diverse","Not Clearly Defined"
"what team isnt from baltimore?","Orioles","Ravens","Blast","Redskins"
"who plays ben gates in national treasure?","Harrison Ford","John Cusack","Aaron Eckhart","Nicolas Cage"
"which simpsons characters catchphrase is aye caramba?","Homer","Millhouse","Marge","Bart"
"what fruit has a botanical name punica granatum?","Raspberry","Persimmon","Cocoa","Pomegranate"
"what is the body part that connects the throat to the stomach?","Pharynx","Larynx","Lungs","Esophagus"
"which oceans touch north america?","Pacific Only","Pacific And Atlantic Only","Pacific, Atlantic, And Indian","Pacific, Atlantic, And Arctic"
"which of these saxophones is the smallest?","Tenor","Baritone","Alto","Soprano"
"which of the following martial arts focuses on grappling?","Capoeira","Taekwondo","Muay Thai","Judo"
"what is considered a perfect round of golf?","Getting A Hole In One On All Par 3'S","Never Going Out Of Bounds","Playing Without A Whiff","Playing Every Hole At One Under Par"
"where do scientists currently believe the asteroid that killed the dinosaurs struck?","The Barringer Crater","The Andes Mountains","The Bering Strait","The Yucatn Peninsula"
"who was the goddess of wisdom war and useful arts?","Hera","Ares","Persephone","Athena"
"which one of these us presidents did not die in office?","William Henry Harrison","William Mckinley","Zachary Taylor","Martin Van Buren"
"which of these artists was a native of pittsburgh pennsylvania?","Frank Lloyd Wright","Salvador Dali","Georgia O'keefe","Andy Warhol"
"when is the fifa world cup played?","Every year","Every 10 years","Every 5 years","Every 4 years"
"what color was lukes lightsaber in return of the jedi?","Purple","Blue","Red","Green"
"what virus causes aids?","Feline Immunodeficiency Virus","Rotavirus","Norovirus","HIV"
"who was fighting who in the pelopennesian war?","Corinth Vs. Sparta","Greece Vs. Persia","Megaera Vs. Corinth","Athens Vs. Sparta"
"what is a traditional cuisine eaten on fridays during the season of lent?","Yogurt","Kosher Pickles","Bread","Fish"
"what state is known as the apple state?","Ohio","Washington D.C","Oregon","Washington State"
"what fruit is grown in the shape of buddha in china?","Oranges","Apples","Cherries","Pears"
"what is the container called designed to store cigars?","Furnace","Smoke Box","Cast","Humidor"
"who was rocky marciano?","A Quarterback","A Soccer Player","A Racer","A Boxer"
"what are the first names of simon?","Glen","Phil","Jim","Paul"
"what is known as the big leagues of baseball?","Super Bowl","Gifs","NBA","MLB"
"in what year was claude monet born?","1814","1910","1890","1840"
"what country was punished at the end of wwi?","Italy","Great Britan","France","Germany"
"what condition is a psychological affliction of the fear of nude bodies?","Gynophobia","Lilapsophobia","Nosophobia","Gymnophobia"
"in to kill a mockingbird by harper lee who is accused of raping mayella ewell?","Atticus Finch","Bob Ewell","Joseph Mettner","Tom Robinson"
"on what side of a u s mail truck is the wheel on?","Back Left","Left","Back Right","Right"
"which country did many members of the nazi party flee to?","Spain","Cuba","Switzerland","Argentina"
"which of these is considered the medium of artwork?","Canvas","Paper","Book","Paint"
"what sport involves dance movement?","Football","Soccer","Tennis","Gymnastics"
"hitting your funny bone is really hitting what nerve in your arm?","Radial","Medial","Sciatic","Ulnar"
"how many years are equal to 252 months?","20","22","23","21"
"in 2014 riots took place in ferguson after teen michael brown was shot and killed where is ferguson located?","Mississippi","Montana","Michigan","Missouri"
"which biblical person had the coat of many colors?","Jesus","Ramses","Jacob","Joseph"
"where did starbucks originate?","New York, Ny","Washington D.C.","Houston, Tx","Seattle, Washington"
"which hockey team plays in new york?","The Knicks","The Mets","The Yankees","The Rangers"
"what mlb baseball team is known for wearing pinstripes on their uniforms?","Chicago White Sox","New York Mets","Boston Red Sox","New York Yankees"
"what art form involves folding paper to make tiny statuettes?","Croche","Foldery","Rollae","Origami"
"what were labrador retrievers bred to do?","Pull Carts Of Heavy Things","Protection","Herding Sheep","Catch Water Fowl"
"what is it called when you write your life story?","Unknown","Biography","#Madebyme","Autobiography"
"what part of the body does rhino refer to?","Head","Brain","Neck","Nose"
"which of these films did meryl streep not feature in?","The Devil Wears Prada","Mamma Mia","The Iron Lady","Les Miserables"
"red blood cells contain which of the following?","Calcium","Potassium","Proteins","Iron"
"what was the first colony to become a us state?","New Jersey","Connecticut","Rhode Island","Delaware"
"what is the word for a word in literature that is also the sound it makes ex buzz bang plop?","Idiom","Oxymoron","Hyperbole","Onomatopoeia"
"what is the name of the reaction of nuclear substances?","Vortex","Deludation","Cremation","Fission"
"what was the one thing pepe le pew was always looking for?","A Way To America","Food","A Way Home","Love"
"the liver of a polar bear contains enough of which vitamin to kill a human?","Vitamin B","Vitamin C","Vitamin E","Vitamin A"
"which character was killed off from family guy for a short period?","Chris","Quagmire","Peter","Brian"
"which of these is not a term used in gymnastics?","Floor","Beam","Bar","Bunt"
"what alfred hitchcock movie has the famous shower murder scene?","The Birds","Rear Window","Vertigo","Psycho"
"which art form involves shaping andor molding with artistic or creative precision?","Building","Tracing","Drawing","Sculpting"
"what was the army of the united states called during the revolutionary war?","The Ministers","The Only Army","The New Ambassadors","The Continental Army"
"which country is named the country of cantons?","Sweden","Norway","Denmark","Switzerland"
"which is not one of santas reindeer?","Dasher","Comet","Donner","Chancer"
"what is the name of the new sequel for finding nemo?","Finding Nemo 2","Nemo and Dory's Journey","There is no sequel","Finding Dory"
"which sport has three periods in a single game?","Soccer","Football","Golf","Hockey"
"who was rocky the flying squirrels sidekick?","Zorba Anteater","Alfred E. Newman","Daisy Dog","Bullwinkle Moose"
"which of the following was not a character on the mash television series?","Hot Lips","Hawkeye","Radar","Smitty"
"how many microns is 0 063 meters?","0.000063","630","0.063","63,000"
"the worlds largest living animal the blue whale mainly eats what?","Sea Urchins","Vegetation","Sharks And Rays","Krill"
"cyanosis is described as what color?","Pink","Purple","Yellow","Blue"
"when was abraham lincolns portrait first pictured on the 5 bill?","1904","1890","1889","1914"
"what continent is croatia on?","Asia","South America","Africa","Europe"
